{
  "$schema": "https://json-schema.org/draft/2020-12/schema",
  "$id": "https://global-family-justice-data.org/schemas/g2_structural_selection_policy.schema.json",
  "title": "Deterministic G2 structural-preflight selection policy",
  "type": "object",
  "required": ["schema_version", "policy_id", "frame_order", "prefix_rule", "assignment_algorithm", "slot_order", "candidate_iteration", "maximum_search_nodes", "primary_count", "reserve_count", "minimum_primary_jurisdictions", "maximum_selected_per_jurisdiction", "maximum_selected_per_source_series", "post_seal_substitution", "adaptive_replenishment", "frame_exhaustion_disposition"],
  "properties": {
    "schema_version": {"const": "1.0"}, "policy_id": {"const": "G2-STRUCTURAL-SELECTION-20260815-01"}, "frame_order": {"const": "ascending_frame_rank"}, "prefix_rule": {"const": "first_prefix_with_feasible_exact_assignment"}, "assignment_algorithm": {"const": "slot_order_rank_ascending_backtracking_v1"},
    "slot_order": {"const": ["primary:embedded_raster_or_dashboard_pdf:1-6", "primary:structurally_complex_mixed_layout_pdf:1-6", "primary:non_english_text_native:1-6", "primary:english_text_native:1-6", "reserve:embedded_raster_or_dashboard_pdf:1-2", "reserve:structurally_complex_mixed_layout_pdf:1-2", "reserve:non_english_text_native:1", "reserve:english_text_native:1"]},
    "candidate_iteration": {"const": "ascending_frame_rank"}, "maximum_search_nodes": {"const": 1000000}, "primary_count": {"const": 24}, "reserve_count": {"const": 6}, "minimum_primary_jurisdictions": {"const": 12}, "maximum_selected_per_jurisdiction": {"const": 2}, "maximum_selected_per_source_series": {"const": 1}, "post_seal_substitution": {"const": false}, "adaptive_replenishment": {"const": false}, "frame_exhaustion_disposition": {"const": "experiment_stopped"}
  },
  "additionalProperties": false
}
